,0
1642,Структура верхней коры и процессы в ней являются
1643,в том числе и верхней коре) являются конвективные движения в мантии
1644,затем перераспределяются в верхних слоях коры и превращаются в локальные и
1645,На различных уровнях верхней коры и даже в пределах одного
1646,Верхняя кора по сравнению с ниже лежащими
1647,лежащими слоями средней и нижней коры в условиях действующих в ней
1648,движение флюидные процессы в верхней коре.
1649,"данным преследует цель разделения земной коры на участки (геоблоки), разнящиеся по"
1650,"Неоднородности в химическом составе земной коры,  «потревоженной» человеком, приводят к возникновению"
1651,режима современных вертикальных движений земной коры (СВДЗК) Северного Причерноморья и зависимости
1652,"познание общего геологического строения земной коры, поиски, оценку и разведку месторождений"
1653,о свойствах и строении земной коры до моделей геолого-экономических оценок освоения
1654,"недрах»:  «недра являются частью земной коры, расположенной ниже почвенного слоя, а"
1655,"тектонического и глубинного строения земной коры, автоматизированного создания геологических легенд и"
1656,в т.н. волноводах) верхней коры.
1657,действия на разных глубинах верхней коры и установить закономерности его проявления
1658,"в тонкой верхней оболочке земной коры толщиной всего 15 км, называемой"
1659,В процессе эволюции коры ее слои испытывают непрерывное перемешивание
1660,силой флюидных процессов в верхней коре в принципе в силу своей
1661,"месторождений в любой точке земной коры необходимы флюидные потоки, примерно в"
1662,"является наличие тектонических сил в коре и разломов, связанных с хрупким"
1663,силой флюидодинамических процессов в верхней коре и причиной образования наблюдаемого распределения
1664,"регионов, современные вертикальные движения земной коры и т.п."
1665,Трещиноватая структура верхней коры в континентальных областях
1666,"топтаться у молодых деревьев, до коры которых мыши большие охотницы."
1667,"и океанов, ни толщина земной коры — не меняются."
1668,"Пожар все больше, уже горит кора на деревьях."
1669,"из Своих пальцев, а если кора вдобавок теплая и тебе хочется"
1670,"во двор, лужайку которого покрыли корой асфальта, а сероствольные грабы все"
1671,"Кора переживает, что Гуидо ненавидит своего"
1672,"бодрящие ноты чайных листьев и коры фигового дерева, а также теплые"
1673,и все это покрыто твердой корой.
1674,это засохшее дерево по темно-серой коре.
1675,снимали с бархата амурского пробковую кору.
1676,"задеть древесину, снимали пласты мягкой коры."
1677,лет оголенное место снова покрывалось корой.
1678,"сможет дать ни ценной пробковой коры, ни целебного сока."
1679,"лебедой мешали-тёрли, с древесной корой."
1680,"Липову кору грыз, на снегу лежал…"
1681,Без коры в Лунёве стояли — деревьи все…
1682,ускорением воткнулся в свою клетку коры.
1683,как специалиста по строению земной коры.
1684,с обломанными ветвями и ободранной корой.
1685,"кафедре геофизических методов исследования земной коры геологического факультета МГУ, которой тогда"
1686,"сжатия возникают глубокие трещины, рассекающие кору."
1687,океане нет погруженных участков континентальной коры.
1688,"академик и директор Института земной коры в Иркутске), принимали участие в"
1689,"самых больших трещин в океанской коре — разломе Элтанин, расположенном в юго-восточной"
1690,"этой гигантской трещины в земной коре, и, казалось бы, игрушечная по"
1691,декоративного элемента часто используется обсыпка корой или галькой почвы вокруг деревьев
1692,"альпинариев, отдельных растений, чередуя камешки, кору, гальку — на усмотрение дизайнера."
1693,"Стоит отметить, что кора создает интересный контраст растения с"
1694,"мысли, как личинка в древесную кору; с чем приехал, спрашивали напряженные"
1695,Под корой таких деревьев живут жуки и
1696,"Уверяю вас, напряжение земной коры здесь чувствуешь сквозь асфальт, сквозь"
1697,время у подвоев хорошо отстает кора.
1698,"нужное место, делают Т-образный надрез коры и вставляют подготовленный глазок благородной"
1699,использовании ядерного оружия) на земную кору.
1700,"незнании состава и строения земной коры, не говоря уже о процессах"
1701,Я подошёл погладил кору.
1702,Кора была теплая.
1703,"а так, слегка зацепился за кору."
1704,тополю прямо между двумя складками коры.
1705,"надежно закрыты плотными чешуйками, а кора способна выдержать и более высокую"
1706,"неотвязно крутятся в голове («Дай коры мне, о береза…») вперемежку с"
1707,"ускорять накопление напряжений в земной коре, увеличивая частоту землетрясений, или способствовать"
1708,флюидов в глубокие горизонты земной коры.
1709,"флюидов в глубокие горизонты земной коры при захоронении загрязненных вод, создании"
1710,"энергии, изменению напряженно-деформированного состояния земной коры и взаимодействия физических полей различной"
1711,A. Человек воздействует на земную кору.
1712,"Только там, где березовая кора не отвалилась, жерди оставались белые."
1713,"Кони принялись грызть на стволе кору желтыми выгнутыми зубами, а их"
1714,"устойчивость мира, порождала в земной коре искривления и трещины, смещала материки"
1715,"и среди черных, как гнилая кора, остатков одежды разыскала несколько стеклянных"
1716,"в гроздьях бузины, в зеленоватой коре осин."
1717,"Маски, должно быть, из коры, с прямыми углами и прорезями"
1718,дерева была высохшей (местами омертвелая кора свисала рваными ремнями — виднелась застарелая
1719,"и подивился дымчатой свежести его коры и еще тому, что всю"
1720,"удаления веток, скребки для удаления коры, специальные захваты для бревен, лопатки"
1721,Пахло мокрой грязью и древесной корой.
1722,"власовцам, верность дружбе, скрытая под корой грубости человечность."
1723,корреляции между поражениями определенных участков коры головного мозга и речевыми нарушениями
1724,между «событиями» на уровне клеток коры и «событиями» на уровне порождения
1725,функции могут выполняться разными участками коры.
1726,"сказать, что связь между участком коры и его функциями взаимно многозначна."
1727,"материальной «уловимости», представляется функционирование клеток коры головного мозга."
1728,приложим предикат «состоять из»  (клеток коры и связей между ними).
1729,"Мы знаем, что пораженные клетки коры не восстанавливаются."
1730,обусловленное органическим поражением речевых зон коры головного мозга.
1731,идет по пути усложнения строения коры на микроуровне.
1732,"эту реальность, сквозь жизнь и кору земную."
1733,когда хочется лбом прижаться к коре дерева и тереться об нее
1734,"зайчишек и станет питаться ивовой корой, сможем ли мы тогда назвать"
1735,"здешней бедноты, обдирали с чурбаков кору и складывали к себе в"
1736,"лишенную жизни плоть, будь то кора и береста или одежда выносимых"
1737,Под корой можно увидеть белые веерообразные пленки
1738,"предельный), наличие сухих ветвей, состояние коры и луба."
1739,рубки достаточно очистить пень от коры.
1740,закрасить масляной краской под цвет коры.
1741,Пораженная кора также срезается.
1742,запломбированное дупло окрашивают под цвет коры и на 10–15 дней
1743,"яиц на ветках или на коре ствола, по их зимним гнездам"
1744,"этих вредителей зимуют в трещинах коры, в листовой подстилке или в"
1745,желтеющая и опадающая хвоя; тонкая кора матового цвета (по сравнению с
1746,цвета (по сравнению с глянцевой корой здоровых сосен); буровая «мука» — мелкие
1747,"вокруг входных отверстий короедов, расклевы коры птицами."
1748,березового заболонника — вентиляционные отдушины в коре вдоль маточного хода выглядят так
1749,закономерностей строения и эволюции Земной коры.
1750,но и условий формирования земной коры в целом.
1751,изучения глубинных зон континентальной земной коры с помощью глубоких и сверхглубоких
1752,и в целом всей земной коры.
1753,"почти все типы разрезов земной коры, от архея до мезокайнозоя включительно"
1754,эксперимент по изучению континентальной земной коры путем прямого проникновения в нижние
1755,"проникновения в нижние горизонты земной коры, хотя бы на глубины 20"
1756,и эволюции глубинных зон земной коры.
1757,и водных растворов в земной коре и их совместное поступление в
1758,"общей характеристики в целом земной коры, да и верхней и нижней"
1759,"являются своеобразными каналами в земной коре, по которым происходит циркуляция газофлюидных"
1760,"флюидный режим в разломах, рассекающих кору и отдельные ее элементы (надвиги"
1761,в коровых волноводах в верхней коре рассматривается с единой точки зрения
1762,"также исследования глубинного строения земной коры показывают, что одни и те"
1763,горные породы в пределах верхней коры ведут себя по-разному в зависимости
1764,волноводов в консолидированных породах верхней коры.
1765,"движений являются горизонтальные напряжения в коре и литосфере, которые создаются в"
1766,В коре и ее верхней части есть
1767,"части — плиты, микроплиты, блоки земной коры и надвиги, которые подчиняются некоторой"
1768,что разломные зоны в верхней коре (до глубин 7 км) в
1769,глубоких горизонтов флюидодинамического поля земной коры и мантии.
1770,прослеживается субмеридиональный пояс сокращенной мощности коры (от 40 до менее 35
1771,Средневолжского изометричного расширения зоны утоненной коры устанавливаются современные аномалии глубинного теплового
1772,Контур зоны утоненной земной коры (по изопахите40 км)  (а) и
1773,"верхней мантии и консолидированной земной коре флюидодинамических систем, формирующихся в астеносфере."
1774,Вынос в верхние горизонты коры глубинного флюида по рассмотренным выше
1775,"полей в осадочном чехле земной коры», прямые поиски обосновываются с помощью"
1776,изучения глубинного строения участков земной коры (получение новых данных о параметрах
1777,"программные модули, обеспечивающие районирование разреза коры по комплексу геофизических данных, аналитические"
1778,интерпретационная модель глубинного строения земной коры.
1779,"руды контролируются пластом железистых кварцитов, корой выветривания которых они являются."
1780,"богатые и окисленные руды — метаморфического, кора выветривания — латеритного типа."
1781,"полей в осадочном чехле земной коры»  [1, 2 и др.], причем"
1782,"фильтрационных процессов в трещиноватых породах коры заходит в тупик, и для"
1783,"понимаются трещиноватые насыщенные массивы земной коры различных масштабов, включая околоскважинное пространство."
1784,изучение глубинного строения участков земной коры (получение новых данных о параметрах
1785,"изучение глубинных границ раздела земной коры, региональных структур осадочного чехла и"
1786,"исследования особенностей глубинного строения земной коры, поведения границ ее раздела, картирования"
1787,"изучение глубинных геоэлектрических горизонтов земной коры и верхней мантии, изучения строения"
1788,"целью выделения активных разломов земной коры, зон современного проявления метаморфизма и"
1789,при изучении глубинного строения земной коры на региональных профилях по комплексу
1790,описывающий распределение сопротивления в земной коре.
1791,псевдоплотностных и псевдомагнитных свойств земной коры.
1792,"г), Испании (д), ксенолитов нижней коры (е)"
1793,породы верхней мантии и земной коры (с последующей полимеризацией и поликонденсацией
1794,главе с Эльдаром Шенгелая и Корой Церетели.
1795,"вверх — и белочка вцепилась в кору совсем рядом с едой, но"
1796,"человеку и дана лобная часть коры головного мозга, где, согласно новейшим"
1797,залежей природного газа в земной коре все более склоняются в пользу
1798,"Такова сила взрыва, взламывающая кору слов, смешивающая и коварно путающая"
1799,Ландау женился на молодой харьковчанке Коре Дробанцевой.
1800,где ствол был чист от коры.
1801,"сделал аккуратный надрез, вырезая квадрат коры сантиметров по двадцать с каждой"
1802,"Потом отодрал кору, положил ее рядом, очистил от"
1803,приставил ладони к освобожденному от коры квадрату ствола.
1804,"растер ее на внутренней стороне коры, сорванной с дерева, и приставил"
1805,учетом скрытой теплоты плавления пород коры и верхней мантии.
1806,"процессов теплопереноса в осадочной толще, коре и мантии литосферы."
1807,"Затянуло корой вбитые в деревья тамги, что"
1808,"умерли, стояли сухие, голые, без коры, без хвои, без листьев."
1809,"трав и листья, мухоморы и кора."
1810,"столпившихся односкатных хибар, крытых берестой, корой, дёрном."
1811,"завёрнутые в куски бересты и коры, ступали по льду, по мёрзлому"
1812,"холма, изрытую ямами, засыпанную золой, корой, ветками."
1813,"по острову, разыскивая съестное: осиновую кору, медвежью дудку, грибы, корни папоротника"
1814,"Глодали ветви, кору, выкапывали из-под снега мох и"
1815,"истирались, словно были из сосновой коры, и приходилось их снова резать"
1816,"вылетали гроздья пузырей, царапал ногтями кору ствола."
1817,"черных пятнах проталин, как березовая кора."
1818,рассеяния химических элементов в земной коре.
1819,"в геохимической истории развития земной коры, как сумму составляющих его кластеров"
1820,доставлены флюидами к поверхности земной коры и таким образом сохранились как
1821,"что весьма характерно для базитовой коры, как первичного продукта атомной диссоциации"
1822,резко повышенный кларк в земной коре и уже реально участвуют в
1823,"самых распространенных элементов в земной коре: Si, Al, Mg, Na, S"
1824,и наивысшее распространение в земной коре.
1825,многие процессы энергомассопереноса в земной коре и литосфере.
1826,"успевшие прореагировать с веществом земной коры, диссипируют в космическое пространство, где"
1827,вся геохимическая картина образования земной коры и ее геосфер.
1828,"процессы, происходящие в глубинах земной коры."
1829,"получали из листьев, трав, цветов, коры, ботвы и даже хвороста."
1830,"синий), стеблями травы душицы (черный), корой лиственницы или травой (зеленый), желтой"
1831,руки от налипших кусочков прелой коры: они с Виктором только что
1832,"они сидят, дескать, и на коре головного мозга."
1833,для нас процесс в земной коре и верхней мантии лишь постольку
1834,"многообразных детерминированных процессов в земной коре, верхней мантии и всех других"
1835,"размеров пространственно протяженные области земной коры и верхней мантии, в которых"
1836,"определенных участков верхней части земной коры, предшествуют значительно более длительные этапы"
1837,"о готовящемся разрыве в земной коре, третьи — о факторах, осуществляющих этот"
1838,"модели рассмотрим физико-механические модели земной коры высокосейсмичных участков, включающих очаговые зоны"
1839,"представляется земной шар, где земная кора является оболочкой вечно сжимаемого очага."
1840,"Картирование региональных неоднородностей земной коры, предположительно связанных с очагами землетрясений"
1841,"вертикальные волноводы в атмосфере, земной коре и в толще морской воды."
