,0
4617,"В Сибири красная березовая кора, находящаяся под берестой и при"
4618,Содранная кора или береста наз. скала.
4619,"людях замерзала одежда, покрывалась ледяной корой."
4620,"Кожа их источена, как кора одряхлевших деревьев, веки изъедены гноем"
4621,"на поверхности планет, в твердой коре их и лаве (магме)."
4622,и выражаются нервными узлами мозговой коры (серого вещества мозга).
4623,она только что покрылась твердой корой; на ней зарождается жизнь.
4624,не так легко «под грубою корою вещества» узреть живую душу.
4625,"Много самшита, у него красивая кора, и сквозь нее угадываешь бледную"
4626,"нам большое, высокое дерево, его кора местами была надрублена и закопчена"
4627,"Кора деревьев сплошь покрыта паразитами, красивым"
4628,"кривыми, косыми туловищами, покрытыми древесной корой, с квадратной, точно обрубок, головой"
4629,"колонны надевались чехлы с древесной корой, превращавшие их в стволы сосен"
4630,"От матери, как с дерева кору…"
4631,"станке, сгрызали с них зеленоватую кору."
4632,"комнаты были обиты внутри еловой корою, очень похожей на дорогую тиснёную"
4633,Окна к утру покрываются ледяной корой.
4634,"не доберешься, он защищен, как корой, своими непроходимыми волосами."
4635,"среди них такой глубокой продажности, коры расчета: на время, на ночь"
4636,хлеб-то… он из сосновой коры… ничего?
4637,"не ко времени ляпнешь,  «из коры, из коры…»"
4638,"времени ляпнешь,  «из коры, из коры…»"
4639,"не усиѣлъ еще проработать земную кору своего существованія, овладѣтъ своей матеріальной"
4640,стряхнул с одежды приставшие кусочки коры и тихонько пошел к Бахчисараю.
4641,"А сейчас кора у осины потрескалась щелями, и"
4642,Кора каштанового дерева — лучший дубильный материал
4643,"дубильный материал, почти наравне с корой дуба."
4644,"дерева Bertholletia excelsa, покрытый серой корой, достигает в вышину 45 метров"
4645,"позвонку, к спинному мозгу, к коре большого мозга и в подкорковые"
4646,"узнал предсовнарком этого государства — сознание, кора большого мозга."
4647,"такого, что не познано еще корою большого мозга."
4648,"таится под этим белыми свечами коры березы, — березу видно через окно"
4649,"У него с боку отвалилась кора, и я поглаживаю его по"
4650,то ты снова оделся бы корой и поднялся бы к самому
4651,конверта я засуну тебе за кору.
4652,"не совсем застыл, и тонкая кора его волнуется на океане раскаленной"
4653,"спадетъ, вѣрнѣе будетъ снята интернаціональная кора, — это есть первая и ничѣмъ"
4654,так как от сотрясения земной коры непроницаемый слой растрескался и вода
4655,"наконец, благодаря особым свойствам земной коры происходит так называемая ионизация атмосферы."
4656,"вес достигших таким образом земной коры отдельностей, был не ниже, примерно"
4657,"Степь покрывается ледяной корой, словно прозрачным стеклом."
4658,"Сумрачное, нелюдимое лицо, обросшее морщинистой корой, неморгающими глазами глянуло на Никиту."
4659,дровина — полено к полену — с корою сырою и отставшей: узор обнаружить
4660,"Кора до боли царапала тело, два"
4661,"слипались, на них образовывалась крепкая кора, и горе тому, кто пробовал"
4662,Кора мешала.
4663,"березовом полене, суковатом, с обтертой корой."
4664,"камерой для фотографирования строения земной коры, минеролог с помощью микро-фотографии изучает"
4665,"вблизи, на его участках, лишенных коры, ясно видна спиральная скрученность древесины."
4666,"они уже много дней, питаясь корою одного из деревьев, за безвредность"
4667,"Маленький кусочек коры, взбрызнутый пулей, упал к ее"
4668,"по битому месту, и древесную кору вместо хлеба жрали, молились так"
4669,"в старых берёзах с потресканной корой на стволах небольшой дом, обитый"
4670,"запахом прелой листвы, и свежей коры, и с движением сока в"
4671,"с белыми кружочками, вырезанными по коре…"
4672,"не материнство, а судороги земной коры."
4673,"с Ладой оказалось, что под корой прожитого все еще теплилась искра"
4674,"пытался сосновым сучком сбить ледяную кору, облепившую мои башмаки."
4675,"Люди, населяющие темные трещины земной коры!"
4676,"В третичный период земная кора морщилась, вздувалась, пузырилась."
4677,"построен на физических свойствах земной коры, а преподавание физики у нас"
4678,"в кратеры потухших вулканов, земная кора покрыться трещинами, города и села"
4679,Анатомически «я» находится в мозговой коре и самой главной его частью
4680,психической деятельности особенностями морфологии одной коры головного мозга невозможно.
4681,все психические функции локализировали в коре головного мозга и субстрат нервно-психических
4682,"волокон, в их местоположении в коре мозга."
4683,"Однако, о соотношении участков мозговой коры с определенными психическими актами в"
4684,"также говорит, что локализируются в коре только чувственные восприятия и психомоторные"
4685,может быть приписано никакой части коры.
4686,"центры, связанные не только с корой и другими отделами центральной нервной"
4687,не можем ограничиться морфологией одной коры головного мозга и даже нервной
4688,"что это не только болезни коры полушарий мозга, как думали Мейнерт"
4689,"Рабкоры, селькоры, юнкоры, коры…"
4690,"Брюки убитого были покрыты корой из крови и грязи, но"
4691,"в помещение несколько обрывков березовой коры с монгольскими письменами, а также"
4692,"долго наблюдал, как возится в коре крепкоголовый, песочного цвета жучок, и"
4693,"Старый черноклювый дятел забил по коре с небывалым ожесточением, — заскучал Пика"
4694,возле той березы с ободранной корой…
4695,поравнялся с березой с ободранной корой).
4696,"пыль, трескалась выжженная солнцем земляная кора, и трещины, обугленные и глубокие"
4697,"В августе начали обдирать кору с караичей и дубов, мололи"
4698,"такие же обширные участки земной коры выступали из под воды, образуя"
4699,"колебания твердой земной оболочки — ее коры, были и такие участки суши"
4700,"и такие участки суши (земной коры), которые дном моря с момента"
4701,"Можно охарактеризовать твердую земную кору, как чрезвычайно непостоянную, подвергаемую изменениям"
4702,"или иных пород, слагающих земную кору."
4703,на основании распространения в земной коре однородных пластов ее.
4704,те или иные отклонения земной коры происходили в различиях условиях; одни
4705,полегеография добывают из недр земной коры с каждым годом все новые
4706,"других древних пород в земной коре, известно только то, что в"
4707,Почему настой горькой коры известного нам дерева исцеляет лихорадку?
4708,"тускнеют и, наконец, покрываются темноватой корой."
4709,"По этой коре еще вспыхивают некоторое время, как"
4710,катятся по гладкой и горячей коре уже застывшей лавы.
4711,"в своей ограниченности видящие только кору и пески, и Он знает"
4712,"воздуху красные полосы солнечных лучей, кора сосен блестела, как бронза и"
4713,"его бокам молодые, очищенные от коры стволы деревьев…"
4714,"И надо наносить всякого товару: коры, поленьев, углей, бересты…"
4715,"и не кара, а кара: кора бывает только на дереве, — недовольно"
4716,владельцы: изразцы были покрыты словно корой.
4717,"их лица, жесткие, как сосновая кора, и потертые, как линолеум на"
4718,дубы и каштаны; по черной коре шла бархатная прозелень; то и
4719,"любой формы, даже на куске коры, если у него есть плоская"
4720,"бы Юпитер был покрыт твердой корой (чего, повидимому, нет) и имел"
4721,"тех мест, где была стерта кора, теперь тоже капал сок, и"
4722,"лапами мог впиться крепко в кору осины, — вот и все!"
4723,"Другие зарываются под кору деревьев, в землю и в"
4724,"находятся в воздухе, в земной коре, в воде рек, озер, морей"
4725,"курим сушеные листья, мелко накрошенную кору."
4726,"У можжевельника синяя сухая кора, а тело крепкое, как кость."
4727,а кожа — как сохлая вишневая кора.
4728,"тошного голода грыз он смолистую кору караича, зубы во рту у"
4729,По земляной морщинистой коре дробным дождем выцокивают раздвоенные копыта
4730,"Миллионы сорокалетних Петров, каждый под корою своих лет и забот, таят"
4731,берез чернели широкими опоясками ободранной коры.
4732,стояла под навесом из кедровой коры дегтярная печь с трубой и
4733,"же стволов, с облупленной вовсе корой, совсем серо-лиловые."
4734,"печки, на серебряных лишаях дубовой коры, неловко подвернув под себя правую"
4735,теплой темной кухне запахом дубовой коры и стынущей вьюшки.
4736,нас колебания токов действия мозговой коры при ее функционировании (см.: Тривус
4737,С. А. Токи действия в коре полушарий головного мозга под влиянием
4738,"электрической энергии, которыми сопровождается возбуждение коры и проводников, должны неизбежно сопровождаться"
4739,Правленія въ Кор. С. X. С. (4 получившіе
4740,"березовыхъ листьевъ,  (горячихъ угольевъ, древесной коры и т. п.)."
4741,"рана его закрывается своей собственной корой, отходит эта жизнь, а внутри"
4742,"такие яркие прогалины, и на коре деревьев такой мокрый блеск, и"
4743,случаях распространенные изменения клеток мозговой коры.
4744,найдены: Nissle’вскoe поражение нервных клеток коры и изменение со стороны глии
4745,ждать от микроскопических исследований мозговой коры и исследований обмена веществ.
4746,где за ночь нарастает ледяная кора на полу.
4747,"нес холодный туман, — он скользкой корой намерзал на крыльях, на стойках"
4748,"нервную систему, начиная с мозговой коры."
4749,"Угнетая в первую очередь мозговую кору, алкоголь производит растормаживающее действие, освобождая"
4750,"центров волна возбуждения, маскирующая заторможенность коры."
4751,Кусочек коры сорвался с дерева и упал
4752,"по стволу, носом крепким отстукивает кору."
4753,"почерневшим лицом, с покрытыми кровавой корой и замотанными в обрывки башлыка"
4754,"конешно, можно и сосновую кору жрать… и другую разную подлятину"
4755,"выколачивал дятел съедобное из сосновой коры, за кору же и держась"
4756,"съедобное из сосновой коры, за кору же и держась, быстрым и"
4757,и повис на тонкой ниточке коры.
4758,"Затвердевшая кора Земли, представляющая как бы насводку"
4759,друга и поддерживающие отломы земной коры (рис. 1).
4760,"и обусловленные им заторы земной коры, объясняются, по названной теории, давлением"
4761,Земная кора — вещество не абсолютно твердое; она
4762,"твердые, нетронутые разрушением части земной коры, которые, повинуясь боковому давлению, напирают"
4763,"поднимается выше уровня соседних участков коры (рис. 3,g)."
4764,"печи, значит, образуется накипь, каменная кора, разбиваешь этакой длинной кочергой."
4765,"холодно, точно я оброс ледяной корой, но сейчас же бросило в"
4766,воткнул палочки с мясом в кору дерева высоко над землей и
4767,"четыре челнока, сшитых из березовой коры берестянки; в каждую из них"
4768,"остатки, сохранившиеся в толщах земной коры в виде окаменелостей, которые позволяют"
4769,"Линии крупных разломов земной коры обыкновенно сопровождаются вулканами, а частые"
4770,"доказывают, что движения в земной коре еще продолжаются и равновесие нарушается."
4771,или из трещины в земной коре на ее поверхности и после
4772,на прочном базисе — твердой земной коре.
4773,"три километра в глубь земной коры, а судите о состоянии недр!"
4774,"определения возраста тех слоев земной коры, в которых находятся."
4775,"и отрицательные, обусловленные строением земной коры."
4776,составе более глубоких частей земной коры оправдываются.
4777,толщей более легких пород земной коры; он состоит из более тяжелых
4778,"драла с живых деревьев живую кору, чтобы дубить ей мертвую кожу."
4779,"от раскрытых почек и набухнувшей коры: корка давно уже треснула, и"
4780,бесчисленные рабочие создавали перегной дикой коры.
4781,дороге глубоко белеют ранами содранной коры — обозы цепляли осями.
4782,"ко рту, прислонилась к дереву, кора впилась ей в плечо."
4783,будут проламывать не успевшую окрепнуть кору быта.
4784,что в эпоху пролетарской диктатуры кору быта поминутно будут проламывать новые
4785,"будет взят в обработку и коре противопоставлена проламывающая ее новая, подвижная"
4786,острое слово должно просверлить толстую кору мозгов и сделать там свою
4787,"и еще не образовалась твердая кора, без сомнения, газовая оболочка Земли"
4788,"того как образовалась твердая земная кора, азот и благородные газы, водород"
4789,и на 1 см здоровой коры и заболони по краю язвы.
4790,"неторопливо скребутся поползни в сосновой коре, и звонко в тающих облаках"
4791,"с большими трудностями разбита покровная кора, от времени сцементировавшаяся так прочно"
4792,"лечу в земле через земляную кору — кости и черепа, куски тела"
4793,"Прорезаю земляную кору, недра земли — песок и камень"
4794,"Копыта звенят, пробивают ледяную кору, не сгибаются ноги."
4795,іюля (ст. ст.) проживающіе въ Кор. С. X. С. галлиполійцы-радіотелеграфисты
4796,Совѣта Объединенныхъ Офицерскихъ организацій въ Кор. С.Х.С. и съ
4797,Оголённые от коры стволы деревьев с заострёнными сучками
4798,и берёза с мохнатой жёлтой корой.
4799,По ожогам на коре он установил время последнего пала.
4800,"Дуб растёт небольшой, с белесоватой корой (на юге кора у дуба"
4801,с белесоватой корой (на юге кора у дуба тёмная).
4802,"оголённые от сучьев лиственницы с корой, снятой кольцами."
4803,"здесь мелколистный клён с серой корой и густой кроной, ильм, красивое"
4804,"красивое, стройное дерево со светлосерой корой, и тис — оригинальное хвойное дерево"
4805,кустарниковая ольха с блестящей тёмной корой.
4806,она должна будет покрыться ледяной корой и совсем замолкнуть.
4807,"говорят теперь об охлаждении земной коры, перемещении земной оси, полюсов…"
4808,"меньшее выделение теплоты, сопротивляемость земной коры уменьшается и могут происходить поднятия"
4809,земли застыла и образовалась твердая кора.
4810,"Скоро одежда превратилась въ ледяную кору; полы шинелей ломались, какъ тонкое"
4811,"интерес к вопросам истории земной коры; и книга Кобера, как бы"
4812,"основные черты, именно, истории земной коры."
4813,"фациального состава осадков, слагающих земную кору и представляющих два главных типа"
4814,"Итак, состав осадков, слагающих земную кору, позволяет различить ее основные элементы"
4815,"и орогенические зоны; история земной коры — это жизнь этих элементов, выражающаяся"
4816,применение этой своеобразной «перкуссии» земной коры.
4817,"насаженных друг к другу, сложена кора; более мелкие и потому многочисленные"
4818,"Итак, благодаря сжатию, земная кора сокращается, распадаясь на прочные плато"
4819,органов обусловливает всю жизнь земной коры: орогенические движения определяют и вулканические
4820,"другим спекулятивным теориям истории земной коры, на точном фактическом материале."
4821,"действительно нужным и полезным, пробивать кору их прозаической борьбы за жизнь."
4822,те значительные движения в земной коре в олигоценовое и миоценовое время
4823,Washington относительно среднего состава земной коры до глубины в 10 и
4824,для более глубоких поясов земной коры.
4825,"соединения, несвойственные глубинным поясам земной коры."
4826,"одна группа соединений, характерных для коры выветривания."
