,0
0,У нас в коре головного мозга есть три независимых
1,"родингитизированных даек, собственно родингитов и кор выветривания перечисленных пород."
2,"не облезлые бревна с содранной корой, — заботливо укутанные почти незаметной сеткой"
3,"почвы можно использовать стружки древесной коры, гравий, мох сфагнум."
4,"Стружки древесной коры идеальны для пальм, небольших деревьев"
5,"с другими веществами, например с корой деревьев, приготавливают снадобья, столь же"
6,"инертными материалами, например, упомянутой уже корой, мелким гравием или гранитным отсевом."
7,Для покрытия дорожки использована кора.
8,"мульчирование посадок торфом, измельченной древесной корой или щепой, что значительно уменьшит"
9,"ПЭТ-картинки, позволявшие увидеть активные участки коры и подкорковых структур в момент"
10,"размера тела моторного нейрона теменной коры, управляющего нашими движениями (150 микрон"
11,которым вживили электроды в зрительную кору.
12,"регистрируемых зрительных импульсов, приходящих в кору, одновременно смотрели и фЯМР — «картинку»."
13,"различные картинки с «распределением» полей коры, отвечающих за любовь и распознавание"
14,"особой программы они сумели «развернуть» кору гиппокампа на плоскости, а это"
15,активизации нейронов двух разных областей коры: языковой и моторной.
16,это особенности кровоснабжения данного участка коры.
17,помощью фЯМР посмотрел активность префронтальной коры человека.
18,"Префронтальная кора привлекает особое внимание исследователей, поскольку"
19,"деятельность связана, в основном, с корой головного мозга."
20,"центральная нервная система, а точнее — кора головного мозга."
21,"можно использовать мульчирующие материалы: измельченные кору хвойных растений или солому, скорлупу"
22,в толстом слое соломы или коры создаются идеальные условия для размножения
23,системах в литосферу и земную кору ранее поступали и продолжает поступать
24,что в литосфере и земной коре в результате процессов ядерной диссоциации
25,элементов в литосфере и Земной коре.
26,процессов ядерной диссоциации в земной коре является наличие в минералах почти
27,"что флюидодинамические потоки в земной коре сопровождаются высокоамперными токами, протекающими в"
28,мантия и верхняя мантия с корой.
29,"Кору слабых деревьев подлечили, заделали дупла."
30,занимающемся исследованием процессов в земной коре.
31,"прокладки может временно заменить березовая кора», что «хозяйственное мыло не растворяется"
32,для пиления деревьев с массивной корой.
33,"ног — на них наросла желто-серая кора, из которой торчал разросшийся, как"
34,"зацепилось в каких-то глубоких слоях коры, и теперь она вспомнила о"
35,"Павел Алексеевич вздохнул: семенники, кора надпочечников… андрогены, несколько разновидностей стероидов"
36,"Точно земная кора сдвинулась и все поменялось, натянув"
37,"береза Литвинова с непривычной пепельно-серой корой, рябина кавказская, Буассье."
38,"бугристыми стволами, покрытыми тонкой серой корой, и небольшими пильчатыми листьями."
39,"и тогда остро пахло горькой корой и листвой, то отступал, пропадая"
40,"с полуобгорелыми проводами, полуочищенные от коры свежие бревна, прутики недавних посадок"
41,"как положено, а из ивовой коры, совсем негодные лапти, непрочные и"
42,"И сдохну, не поцарапав земной коры?.."
43,Попытаемся оставить царапину на земной коре.
44,"Брызгала сосновая кора и, мягко шурша, осыпалась в"
45,"трона, искусно вырезанного из кедровой коры."
46,"сосну, спиралью обошла ствол, пропахала кору до древесины и нырнула в"
47,"осиновую веточку, сгрызла с нее кору."
48,"Лосиха поглодала осиновой коры, потом переломила зубами ветку и"
49,"неживая, мертвенно-сизая, серебристо-зеленая, с обвалившейся корой, и кора тоже лупилась, коробилась"
50,"серебристо-зеленая, с обвалившейся корой, и кора тоже лупилась, коробилась и просто"
51,"у нее были шершавые, как кора, но в некоторые дни она"
52,Листья этих веток и кору попугайчики охотно поедают.
53,Почки и кора этих веточек содержат в себе
54,"С. Д. Каминского «Динамическое нарушение коры головного мозга», М., 1948, стр"
55,средствами сейчас давят тебе на кору и подкорку?
56,"ствол и, обрывая когтями кусочки коры, убежал вверх по стволу, в"
57,"сверху посыпалась какая-то шелуха, кусочки коры — летяга спускался вниз."
58,"время войны, в голодуху, когда кору ели."
59,три миллиарда лет существования земной коры.
60,Пила брызнула коричневым порошком коры.
61,то уж берёсту или сосновую кору найду я и в тайге.
62,"Новоград-Волынска и Ченстохова, где ели кору с деревьев, траву и умерших"
63,"деревья меняют не листья, а кору — все шиворот-навыворот, страна наоборот, как"
64,"умеют
. 	Деревья сами лезут из коры
, 	Там кролики страшней, чем наводненье"
65,"Дьюрак напоминали рисунки аборигенов, красноватую кору эвкалиптов, и от этого достоверность"
66,"Человеческие фигурки, вырезанные из коры, расписные бумеранги, щиты, копьеметалки, корзины"
67,"Висели картины, сделанные на коричневой коре эвкалипта."
68,И кора на нем на солнце блестела
69,"поморщится, кожа на лице — как кора дубовая."
70,"ветки, обдирал иглы вместе с корой."
71,"ветки на куски, не обдирая коры, и заталкивал добычу в мешок."
72,"беловатых отростков, покрытых коричневой теплой корой."
73,"пилили дрова, — бревно было изрезано, кора сколота."
74,"Беличьи когти зашуршали по коре дерева, синие тела зверьков метнулись"
75,Крошки коры перестали сыпаться на снег.
76,"брат, знаю: каждый корешок, и кору, и цветочки, и каждую траву"
77,"И вдруг, сдирая с коры своего мозга разъедавшую его слабость"
78,"бумаги, почувствовал чуть горьковатый запах коры и земли, а над всем"
79,разные стороны корнями и содранной корой.
80,ноги и рассеянно постучал по коре.
81,"большого дерева с нежной, блестящей корой."
82,"всеми шестью лапами в шероховатую кору сирени, но Зинке Фокиной было"
83,"засветилось, и все деревья запахли корой своей и почками."
84,"опирался на суковатую, очищенную от коры палку, заменявшую ему костыль."
85,Из кедровой коры смастерил он лодочку с парусом
86,"из влажной, как будто отпотевшей коры новыми узкими и яркими листьями."
87,"Прут был неочищенная от коры удочка, которой она с ним"
88,"всякое дерево, и мох на коре, и мочажины, и камни — все"
89,"стал, отощали вконец и только кору осиновую жевали."
90,"делами людей, то сквозь жесткую кору грехов и заблуждений мы различим"
91,"сударь, не выбиться из этой коры!"
92,"поток, то скрываясь под ледяной корою, то с пеною прыгая по"
93,"пихта, точная ель, иглою мягче, кора похожа на осиновую; изб из"
94,серого вещества толще в теменной коре у женщин по сравнению с
95,рецепторов допамина в эстрастриатуме (область коры головного мозга).
96,"полушарий), и мозолистое тело, связывающее кору правого и левого полушарий, у"
97,"и извилины неокортекса млекопитающих (новой коры, основной части коры больших полушарий"
98,"млекопитающих (новой коры, основной части коры больших полушарий) сформировались из специализированных"
99,"областях, на голых скалах, на коре деревьев, в высокогорьях."
100,"к деструкции нейронов в сенсомоторной коре, к диффузному и очаговому клеточному"
101,диффузному и очаговому клеточному опустошению коры.
102,1/3 количества нейронов в сенсомоторной коре может отразиться на морфофункциональном состоянии
103,"с водой, мелкие легкие камешки, кора дерева, зернышки, крошки."
104,"не только на естественных — скалах, коре деревьев и почве, но и"
105,"плотью, оборачивающейся в свою очередь корой дерева, но в нем также"
106,правой руки в моторной области коры левого полушария происходит уменьшение так
107,смог воспроизвести часть зрительного кортекса коры крысы.
108,"же, как работает наша зрительная кора, — но что там конкретно происходит"
109,которое они высасывают прямо с коры.
110,"иногда лень спускаться вниз по коре, переставляя ножки."
111,"О том, что большие полушария коры головного мозга функционально не идентичны"
112,"тело — образование, расположенное непосредственно под корой головного мозга, как раз по"
113,"путей, проецирующееся в противоположную область коры), сразу же становится достоянием правого"
114,"электросудорожной терапией, сопровождается временным угнетением коры больших полушарий."
115,"ветвями, связывали толстой бечевкой из коры."
116,которые регулярно вырываются из-под ледяной коры спутника через трещины.
117,Колончатая организация коры головного мозга.
118,Колонки зрительной коры.
119,Роль коры и глубоких структур головного мозга
120,"сейсмических колебаний, как и земная кора."
121,"что человек задействует большую часть коры головного мозга, даже когда спит."
122,"камнях, мифических животных в завитках коры или некие фатальные знамения в"
123,в сетчатке глаза и в коре головного мозга у человека первым
124,"на кедр, только покраснее, а кора гладкая."
125,эти изменения в колебаниях земной коры.
126,Но сошкуренная древесной корой рука не шибко болела.
127,"бегал по шелестящему, в отрепьях коры, стволу сосенки."
128,"над тобою живым и высоким, 
 Корой обрастать и ветвями звенеть!"
129,Основная масса — кора дуба.
130,и сдабриваешь все этой березовой корой.
131,шляпка в шершавой и грубой коре.
132,горсть сухой травы с перетертой корой.
133,Он зачерпнул горсть перетертой коры и громко захрумкал.
134,Есь достал горсть коры.
135,как старичок ласково трогает грубую кору высоких деревьев.
136,Такая чешуйчатая кора.
137,"теряет гелий, образующийся в земной коре во время процессов распада радиоактивных"
138,"мы можем найти в земной коре, гелий на Земле появился много"
139,"элементы образовались до формирования земной коры, их ядра не стабильны, и"
140,гелий непрерывно образуется в земной коре с момента образования нашей планеты.
141,"гелия просачивается через поры земной коры в атмосферу, медленно покидая ее"
142,В земной коре этот элемент был обнаружен в
143,форм существования бериллия в земной коре являются минералы берилл и изумруд
144,"18 на разных участках земной коры различается, и современные методы анализа"
145,В земной коре бериллий представлен только одним стабильным
146,которого алмазы формируются в земной коре — первая технология получения искусственных алмазов
147,большие запасы нефти в земной коре.
148,"химических элементов, потому в земной коре он присутствует в виде оксида"
149,"различных растений, в результате из коры редкой породы дерева — тихоокеанского тиса"
150,самых распространенных элементов в земной коре (занимает четвертое место после кислорода
151,позволило ему сохраниться в земной коре.
152,Ниже приведено содержание в земной коре некоторых химических элементов (в процентах
153,"жалуется на «существователей», которые «задавили корою своей земности, ничтожного самодоволия высокое"
154,Скобелем от коры зачистил.
155,ударной волной с него содрало кору.
156,"подопытному электрически простимулировать переднюю часть коры, он не испытает никаких субъективных"
157,"затылочные и височные части задней коры), то счастливчика ждет сенсорный приход"
158,Именно на заднюю кору мозга ученые и возлагают надежды
159,"ученым непонятно, чем же задняя кора так сильно отличается от передней."
160,маленькой пластинке серого вещества под корой полушарий.
161,мозг пассивно обрабатывал его частью коры вокруг первичной слуховой области.
162,"шишка, не то ошметок древесной коры — попалось и вновь пропало где-то"
163,Припал щекой к шершавой коре в известковых комках и терся
164,"стволы пахнут весенней влагой, морщинистая кора кое-где прострелена зелеными листьями."
165,инеем стены в лохмотьях несоструганной коры; сбитый из толстых досок ящик
166,"веток, а то и поцарапать кору."
167,сверху принесенной из леса березовой корой; укутали яблони снегом.
168,"И замечать оттенки древесной коры: рыжей на сосновых стволах, серой"
169,"делают из чего-то натурального вроде коры дуба, болотной тины или перхоти"
170,"Кора мозга их как-то обрабатывает, обобщает"
171,В итоге до коры головного мозга доберётся набор сигналов
172,"Континент — это крупный массив земной коры, большая часть которого не покрыта"
173,"огромный регион, покрытый именно континентальной корой."
174,"Напомню, земная кора бывает двух типов — океаническая и"
175,А континентальная кора сложена главным образом из гранита
176,"Во-первых, мощная кора континентального типа в «Зеландии» отсутствует."
177,гвоздях или питаться только дубовой корой — пожалуйста.
178,"кремнезём (SiO2), которого много в коре и мантии."
179,"Префронтальная кора, отвечающая за контроль и рациональное"
180,"благодаря этому будет укрепляться префронтальная кора, и человек станет менее уязвимым"
181,"означал, что у пациентов погибла кора головного мозга, одно из названий"
182,"пациентам, однако восстановить полноценное функционирование коры головного мозга у некоторых из"
183,способом является модуляция возбудимости нейронов коры с помощью слабого (<2 мА
184,стимуляции является воздействие на нейроны коры головного мозга серией магнитных импульсов
185,степень функциональной связности различных зон коры между собой.
186,"ТМС стимулируется точно определенная зона коры, а ответ нейронов на стимул"
187,"стимул, который распространяется по всей коре, регистрируется с помощью ЭЭГ высокой"
188,"ответ распространяется по различным областям коры), то нарушения сознания характеризуются утратой"
189,интегрированности (возбуждение не распространяется по коре).
190,"Это область коры головного мозга, которая не особенно"
191,"жалобой гольда на обрывке березовой коры, захотелось Неретину, чтобы одним из"
192,"установление синаптических связей между участками коры головного мозга, ответственными за слух"
193,В итоге при возбуждении коры звуком колокольчика у собаки начиналось
194,"активности; тонкая, только-только образовавшаяся кора не могла выдерживать напора кипящей"
195,представители обеих фракций предпочитали обдирать кору со ствола и скармливать ее
196,с письмом — повреждение какого-то отдела коры головного мозга блокирует возможность генерировать
197,"умирающие», то снова активизирующиеся участки коры обеспечивают быструю смену реакций — от"
198,описавшего множество уникальных случаев поражения коры головного мозга.
199,"может отражать прогрессивную перестройку новой коры головного мозга, в особенности лобной"
200,"некоторые сезоны седибы, похоже, глодали кору и древесину; такого не замечено"
201,"Может, раскрашивали куски коры, может — друг друга, а то"
202,"которой можно покрасить стену, кусок коры, шкуру или друг друга (Villa"
203,"Кирилл Еськов, на формирование новой коры головного мозга великое влияние оказывает"
204,автономная работа контролируется соответствующими центрами коры головного мозга.
205,"временем до тех пор, пока кора головного мозга не сможет сама"
