,0
3125,"руку и достал кусок гнилой коры, светившийся таинственно и прекрасно."
3126,"Пахнет горечью осенней земли, корой ивы, речной сыростью, дымом от"
3127,мелкие хвоинки и чешуйки серой коры.
3128,"Сгнила, изломалась кора, но опоры, на которых она"
3129,Он приподнял обломки коры.
3130,"Можно положить на снег куски коры, а плечи прикрыть одеялом."
3131,и шуршал по обломкам лиственничной коры.
3132,"огню, он повалился на лиственничную кору, с которой перед этим поднялся"
3133,"свежей листвы, травы и воды, коры и смолы, смешавшись вместе, волновали"
3134,"что казалось съедобным — шкурки зверей, кору, ремни и т. д."
3135,реальное физиологическое состояние — настроенность механизмов коры головного мозга на восприятие определенных
3136,"такого редкого (содержание в земной коре 0,004 %) и рассеянного элемента"
3137,Судите сами: сейчас в земной коре из каждых ста атомов семнадцать
3138,"поливали «клеем сильным» из еловой коры с ячменным отваром, посыпали «мукою"
3139,"или конструкцию необходимо очистить от коры, извести, цемента, старой краски."
3140,"Еловая, берёзовая, сосновая кора хрустела под ногами."
3141,"лежал под отличным берёзовым стволом, кора такая белая, словно пудрой припорошена"
3142,"Он лёг на бок на кору и стружки, среди приятно пахнущих"
3143,"пятитысячному кольцу (если считать от коры), и определить количество C14 в"
3144,дерева и не оставляют на коре шрамов.
3145,Лейкопластырь на коре
3146,"изоляционная лента, хорошо прилипающие к коре, а также полиэтиленовая и полихлорвиниловая"
3147,"Подсчитано, что в коре Земли около 6,5 • 10"
3148,"кажется, она узнает его белую кору… свою любимую березку-кривульку."
3149,"как лопата, руку Федора, поглаживающую кору березы: на потной коже этой"
3150,и остывающей от дневного зноя коры деревьев вливал в нее свежие
3151,"ни форма черепа, ни строение коры больших полушарий, ни вес мозга"
3152,При смещениях земной коры отдельные пласты известняка оказывались погребенными
3153,"Содержание хлора в земной коре составляет 0,20 % по весу."
3154,"Действительно, наибольшая часть углерода земной коры содержится не в организмах растений"
3155,"Из коры эвкалипта добывают дубильные вещества, используемые"
3156,"все-таки не древесина и не кора, а листья эвкалипта, в которых"
3157,"мочи коров и слонов, питающихся корой мангового дерева."
3158,"информации может обусловливать степень возбудимости коры больших полушарий, т. е. влиять"
3159,"народной медицине как потогонное, а кору — еще и как слабительное."
3160,и объедает боковые побеги и кору.
3161,"в том, что в земной коре есть элементы — долгожители нептуниевого радиоактивного"
3162,"меж рамами окон, ну — иссеченная кора деревьев, сорванные буквы вывесок, грязь"
3163,"пленку у самой поверхности земной коры, а ниже идет многокилометровая толща"
3164,энергия подземных вод в земной коре — приблизительно 3 • 10 27
3165,"информацию, записанную на лоскутах березовой коры, и наш долг — принять ее"
3166,"поломанные кусты или ободранную рогами кору на деревьях, то можете не"
3167,в 1962 году в земной коре удалось найти мизерные количества технеция
3168,чтобы комар пытался прокусить древесную кору или лист металла.
3169,"Он плотно прилегает к коре, а если все же образуются"
3170,"растягивается; под ним не преет кора, его всегда легко передвинуть на"
3171,этой гряды происходит разрыв земной коры.
3172,создавались в результате раздвижения земной коры.
3173,"числу самых распространенных элементов земной коры, на его долю приходится лишь"
3174,слова: она встречается в земной коре.
3175,"примерно половина (!) общей массы земной коры, которая почти полностью сложена из"
3176,обсаженную высокими деревьями с темно-оливковой корой прямых стволов.
3177,"илом, плотины, разломанные смещениями земной коры."
3178,"уловить родной запах смолы и коры, нагретой солнцем."
3179,уходили все глубже в земную кору.
3180,"глубинных ультраосновных пород фундамента земной коры, очевидно, и здесь слагающих нижние"
3181,и здесь слагающих нижние зоны коры Торманса.
3182,"многослойной внизу, на комлях, могучей корой."
3183,"из них, цокая и царапая кору, смотря на нас большими глазами"
3184,"на шее сзади потрескалась, как кора на старом дереве."
3185,"росли за баней — толстые, суковатые, кора на комле в вершок, и"
3186,"Окаменевшие шишки, хвою, кору, древесину предка аянской ели (ее"
3187,волос (равно как и пробковая кора) с каждым годом становится все
3188,"вытянутый, четкий, в чешуйчатой прекрасной коре, был как жизнь, которой не"
3189,"солнца, и во тьму земной коры, в невидимые частицы вашего сердца"
3190,чувств через подкорковые образования в кору.
3191,"резко снижают энергетический уровень (тонус) коры мозга, и это может привести"
3192,мозга и участком клеток в коре полушарий.
3193,Благодаря этому в коре головного мозга возникает сильный очаг
3194,индукции вызывает торможение остальных участков коры.
3195,"центр», но и те участки коры головного мозга, где запечатлен учебный"
3196,"своим физиологическим субстратом тормозное состояние коры больших полушарий, представляет различные степени"
3197,отделении от летательного аппарата в коре головного мозга парашютиста возникает сильный
3198,"возбуждения, который затормаживает деятельность остальной коры."
3199,"части мозга, мозжечка и анализаторов коры полушарий, которые непрерывно перерабатывают информацию"
3200,теми или иными участками земной коры.
3201,те или иные участки земной коры.
3202,Но и без этого земную кору можно уподобить чутким весам.
3203,"фосфор широко распространен в земной коре, главным образом в виде фосфата"
3204,"фосфор широко распространен в земной коре, главным образом в виде фосфата"
3205,В земной коре фосфор встречается исключительно в виде
3206,"приходится 0,08 % веса земной коры."
3207,образовались в момент становления земной коры.
3208,"всю великую последовательность напластований земной коры, — с другой."
3209,существовании этих элементов в земной коре можно обсуждать всерьез.
3210,"Ведь есть же в земной коре уран, торий и другие радиоактивные"
3211,"Восприимчивость коры больших полушарий, — перебил я его"
3212,"не были найдены в земной коре до того времени, пока их"
3213,Существование Pu239 в земной коре объясняется реакцией захвата нейтронов ядрами
3214,"о том, что в земной коре существует второй, менее значительный в"
3215,"процесс поступления урана в земную кору из вещества мантии, В. В"
3216,"жизни нашей планеты в земную кору поступало больше U235, чем U238."
3217,Почти 18 % веса земной коры приходится на долю калийсодержащего минерала
3218,"от сорванных бурей сосновых иголок, коры и сучьев."
3219,"него дома, потрогать их шелушащуюся кору, древесную сухую кожу, чисто и"
3220,"белые, как веточки с ободранной корой, руки и попыталась протянуть их"
3221,"них, говорят, обувь сплетена из коры."
3222,"незримо оброс трагической и грязной корой подлости, слабодушия."
3223,в легкой чешуе отслаивающейся тонкой коры широко распростерли ветви с зелеными
3224,• 10 -40 веса земной коры.
3225,"так уж мало: в земной коре, на глубине до трех километров"
3226,почти 20 % веса земной коры.
3227,"Мальчики эти весною пробуравливали кору берез, подставлялси жолоб для стекавшего"
3228,вопрос о «Локализации функций в коре больших полушарий мозга».
3229,Распространенность элементов в земной коре характеризуется так называемыми «кларками» — средним
3230,уменьшением содержания элемента в земной коре его цена возрастает.
3231,Кора и листья волчника совсем лишены
3232,"же как и у липы, кора волчника очень легко обдирается длинными"
3233,Кора волчника на вкус очень горькая
3234,"Химики, исследовавшие кору волчьего лыка, обнаружили в ней"
3235,Кроме дафнина в коре волчника содержится желтое красящее вещество
3236,Раньше кору волчьего лыка употребляли наружно как
3237,"Так же как кора и листья, сочные плоды и"
3238,"получать красную краску, а из коры — желтую."
3239,земляным полом и крышей из коры или тростника.
3240,Острым ножом старик осторожно снимает кору.
3241,"клюв, видно было, как отлетает кора от его удара."
3242,Заметив в коре дерева подозрительное отверстие и внимательно
3243,"На самом деле земная кора на 0,0015 % состоит из"
3244,"Его среднее содержание в земной коре (кларк) — 0,04 г на тонну"
3245,этого изотопа в аргоне земной коры.
3246,В земной коре находится мощный источник аргона-40
3247,"возрастать содержание аргона в земной коре и атмосфере, куда аргон «выдыхается"
3248,мог бы существовать в земной коре в наши дни.
3249,"того, чтобы утверждать — в земной коре существует сверхтяжелый трансурановый элемент, но"
3250,"уезжают ночевать в село,  «на коравах» остается одна тетя Дина, она"
3251,"кое-где пробился фиолетовый даже оттенок, кора ствола в салатовом лишайнике."
3252,к среднему содержанию в земной коре.
3253,Содержание ее в земной коре всего 4 • 10 -5
3254,"Танниды находят в коре, плодах, да и в самой"
3255,что «до потопа» в земной коре радиоактивного калия было не меньше
3256,"этом районе и разломы земной коры, с которыми обычно связаны вулканы."
3257,"бы речь шла о земной коре, это утверждение следовало бы признать"
3258,"Действительно, по распространенности в земной коре железо уступает кислороду, кремнию и"
3259,"К земной коре относят атмосферу, гидросферу, биосферу и"
3260,"подобно электростанции, снабжает энергией клетки коры головного мозга."
3261,"Пока клетки коры бодрствуют, поддерживаемые энергией ретикулярной формации"
3262,"и подача энергии к клеткам коры, клетки высвобождают из-под своего контроля"
3263,прерывая подачу энергии к клеткам коры.
3264,"трети никеля, содержащегося в земной коре, приходится на долю изотопа Ni58."
3265,"конечно, догадались, что на снимке — кора березы, береста."
3266,"лекарство, алкалоид, получаемый экстракцией из коры хинного дерева."
3267,изданиях кларк (содержание в земной коре) ниобия разный.
3268,"что содержание сурьмы в земной коре весьма незначительно, следы ее были"
3269,"моря — это гигантский разлом земной коры, 
 образовавшийся миллионы лет назад."
3270,"пор происходят вертикальные перемещения земной коры, за счет которых, в частности"
3271,время Земля вызывает в лунной коре особенно сильные так называемые приливные
3272,"был крепок и черен, но кору бороздили такие же глубокие морщины"
3273,"Ина березка и с ободранной корой красавица, а ина и во"
3274,"была оставить в толщах земной коры свидетельства, повествующие об исчезнувших с"
3275,"Легкие породы земной коры сложены, оказывается, преимущественно из кремния"
3276,"прорывается в верхние слои земной коры, а иногда и на ее"
3277,то «текучей» массе покоится земная кора.
3278,"чем легче какая-нибудь область земной коры, тем выше она будет подниматься"
3279,"равновесия, чем те области земной коры, которые сложены преимущественно из толстых"
3280,сиаль равномерно по всей земной коре.
3281,"в основном поверхностные слои земной коры, то есть сиаль, сима осталась"
3282,"восходящие течения), достигают твердых пород коры и растекаются под ними горизонтальными"
3283,"антициклонических центров, давление магмы повышается: кора в этой области поднимается (за"
3284,потоков и пониженного магматического давления кора опускается.
3285,"сон прозрачная, еле заметная зелень коры."
3286,"около крохотного болотного родничка, разрубил кору на молодой березе, содрал бересту"
3287,"Содержание серы в земной коре составляет 0,05 % по весу."
3288,"Земная кора в местах, расположенных близ месторождений"
3289,лососей резко увеличивается выработка гормонов коры надпочечников — 17-оксикортикостероидов.
3290,"расцветили пятнами красные островки остывающей коры, меж ними пробегали голубоватые огоньки."
3291,"обидности настоящее, с тугой шершавой корой."
3292,"с красным соком под шершавой корой, есть в море рыбы с"
3293,"корневище, у коричного дерева — в коре."
3294,"И в коре головного мозга, где раздражения фиксируются"
3295,"В земной коре хрома довольно много — 0,02 %."
3296,тонкую неотесанную жердочку с коричневой корой.
3297,Хотела погрызть горьковатой коры.
3298,Вековые сосны в бурой коре от века изрыты глубокими трещинами.
3299,примесь в различных минералах земной коры.
3300,по рубцам на их старой коре.
3301,"кураре, который они добывали из коры некоторых растений."
3302,которые усиливают тормозные процессы в коре больших полушарий мозга.
3303,В земной коре цирконию всегда сопутствует гафний.
3304,"которое выделяется из трещин ее коры, как смола у наших северных"
3305,в почве и массе земной коры.
3306,поведение отдельных элементов в земной коре обусловлено их химическими свойствами.
3307,в самой верхней части земной коры — в биосфере.
3308,концентрацией химических элементов в земной коре и различными сторонами жизни и
3309,прошедший после образования твердой земной коры.
3310,"расследования на радий всей земной коры, составления мировой карты радиоактивных минералов»."
3311,"элементам в истории формирования земной коры, в тепловом балансе планеты."
3312,состава организмов с химией земной коры и то огромное — первенствующее — значение
3313,"живое вещество в механизме земной коры, указывает нам, что разгадка жизни"
3314,к его первоисточнику — к земной коре».
3315,элементов на различных участках земной коры.
3316,"представляющий собой его отражение в коре головного мозга, не получая подкрепления"
3317,"закрепить кислородное возбуждение, возникшее в коре головного мозга."
3318,процессы возбуждения и торможения в коре головного мозга могут у разных
3319,"балансируя, прижав руку к влажной коре молодой березы на краю нашего"
3320,"металлам: его содержание в земной коре оценивается в 0,0055 %, его"
3321,"жесткая, с трещинами в ладонь кора мешала ему устроиться как следует."
3322,"у ольхи, отковыривая куски старой коры от ствола."
3323,"Рогов, растирая в пальцах кусок коры и отбрасывая его, Вера неприязненно"
3324,резче пахнуть хвоей и еловой корой.
3325,"тихо дышала, на ее мутно-белой коре жил с северной стороны лишайник"
3326,"и, пригнувшись лицом к теплой коре, тихо плакала."
3327,"или победа, и хватит есть кору, и пора дать этим проклятым"
3328,"пень, от которого осталась одна кора, а внутри все ссыпалось и"
3329,Пахло жженой корой и горелым салом свечей.
3330,"прикоснуться ладонью к живому, покрытому корой стволу."
3331,"Они крошили жженую кору, чтобы целительным пеплом присыпать пупок"
3332,с кислородом кремний составляет земную кору.
3333,"и все, кто способен обглодать кору."
3334,"А казалось бы, осиновая кора горька, словно хина."
3335,"Потому осиновую кору любят все звери, что она"
3336,ежедневно потребляю настойку на осиновой коре.
3337,"Зеленую молодую кору я обстругиваю с дерева, сушу"
3338,пейте настойку на целебной осиновой коре! )
3339,"от белых берез, от черной коры дубов, лип и вязов."
3340,"и ростом, четвертое цветом ствола, коры."
3341,"стволу, 
 Подошвами босыми упираясь, 
 С коры стирая белую пыльцу, 
 До онеменья"
3342,Береста — это не вся березовая кора.
